"Experiment","Sentence","Item","List","Content","No","Yes","Group","Question","AnswerL","AnswerR","Correct"
"MovingProc8","The_architect built the_monument for_two_years after the_city had_finally_provided the_money_for_it.",1,1,"content question","yes = 1","no = 5",1,"What did the city provide money for?","A monument","A gallery","L"
"MovingProc8","The_architect built the_monument within_two_years after the_city had_finally_provided the_money_for_it.",1,2,"content question","yes = 1","no = 5",2,"What did the city provide money for?","A monument","A gallery","L"
"MovingProc8","The_architect was_building the_monument for_two_years after the_city had_finally_provided the_money_for_it.",1,3,"content question","yes = 1","no = 5",3,"What did the city provide money for?","A monument","A gallery","L"
"MovingProc8","The_cook made the_African_beef_stew for_two_hours after he had_planned the_menu.",2,1,"content question","yes = 1","no = 5",2,"Who planned the menu?","The restaurant manager","The cook","R"
"MovingProc8","The_cook made the_African_beef_stew within_two_hours after he had_planned the_menu.",2,2,"content question","yes = 1","no = 5",3,"Who planned the menu?","The restaurant manager","The cook","R"
"MovingProc8","The_cook was_making the_African_beef_stew for_two_hours after he had_planned the_menu.",2,3,"content question","yes = 1","no = 5",1,"Who planned the menu?","The restaurant manager","The cook","R"
"MovingProc8","The_artist painted the_picture for_more_than_three_days after he had_finally_signed the_contract.",3,1,"content question","yes = 1","no = 5",3,"What did the artist do before painting?","Sign a contract","Write a letter","L"
"MovingProc8","The_artist painted the_picture within_three_days after he had_finally_signed the_contract.",3,2,"content question","yes = 1","no = 5",1,"What did the artist do before painting?","Sign a contract","Write a letter","L"
"MovingProc8","The_artist was_painting the_picture for_more_than_three_days after he had_finally_signed the_contract.",3,3,"content question","yes = 1","no = 5",2,"What did the artist do before painting?","Sign a contract","Write a letter","L"
"MovingProc8","The_mechanic changed the_tire for_ten_minutes after he had_finished his_lunch_break.",4,1,"content question","yes = 1","no = 5",1,"When did the mechanic start changing the tire?","After breakfast","After lunch break","R"
"MovingProc8","The_mechanic changed the_tire within_ten_minutes after he had_finished his_lunch_break.",4,2,"content question","yes = 1","no = 5",2,"When did the mechanic start changing the tire?","After breakfast","After lunch break","R"
"MovingProc8","The_mechanic was_changing the_tire for_ten_minutes after he had_finished his_lunch_break.",4,3,"content question","yes = 1","no = 5",3,"When did the mechanic start changing the tire?","After breakfast","After lunch break","R"
"MovingProc8","Simon drank the_wine for_more_than_half_an_hour after he_had turned_on the_television.",5,1,"content question","yes = 1","no = 5",2,"What kind of drink did Simon have?","Wine","Beer","L"
"MovingProc8","Simon drank the_wine within_half_an_hour after he_had turned_on the_television.",5,2,"content question","yes = 1","no = 5",3,"What kind of drink did Simon have?","Wine","Beer","L"
"MovingProc8","Simon was_drinking the_wine for_more_than_half_an_hour after he_had turned_on the_television.",5,3,"content question","yes = 1","no = 5",1,"What kind of drink did Simon have?","Wine","Beer","L"
"MovingProc8","The_president delivered the_address for_half_an_hour as_soon_as he_had entered the_hall.",6,1,"content question","yes = 1","no = 5",3,"Who delivered the address?","The chancellor","The president","R"
"MovingProc8","The_president delivered the_address within_half_an_hour as_soon_as he_had entered the_hall.",6,2,"content question","yes = 1","no = 5",1,"Who delivered the address?","The chancellor","The president","R"
"MovingProc8","The_president was_delivering the_address for_half_an_hour as_soon_as he_had entered the_hall.",6,3,"content question","yes = 1","no = 5",2,"Who delivered the address?","The chancellor","The president","R"
"MovingProc8","The_Prussian_army destroyed the_city for_a_week after they_had surmounted the_city_wall.",7,1,"content question","yes = 1","no = 5",1,"Who attacked the city?","The Prussian army","The Austrian army","L"
"MovingProc8","The_Prussian_army destroyed the_city within_a_week after they had_surmounted the_city_wall.",7,2,"content question","yes = 1","no = 5",2,"Who attacked the city?","The Prussian army","The Austrian army","L"
"MovingProc8","The_Prussian_army was_destroying the_city for_a_week after they_had surmounted the_city_wall.",7,3,"content question","yes = 1","no = 5",3,"Who attacked the city?","The Prussian army","The Austrian army","L"
"MovingProc8","The_worker loaded the_barrow for_more_than_one_minute after he_had figured_out what_he_needed.",8,1,"content question","yes = 1","no = 5",2,"What did the worker do?","Unload a truck","Load a barrow","R"
"MovingProc8","The_worker loaded the_barrow within_one_minute after he_had figured_out what_he_needed.",8,2,"content question","yes = 1","no = 5",3,"What did the worker do?","Unload a truck","Load a barrow","R"
"MovingProc8","The_worker was_loading the_barrow for_more_than_one_minute after he_had figured_out what_he_needed.",8,3,"content question","yes = 1","no = 5",1,"What did the worker do?","Unload a truck","Load a barrow","R"
"MovingProc8","The_athlete ran the_marathon for_two_hours after he_had returned from_the_training_camp.",9,1,"content question","yes = 1","no = 5",3,"What event did the athlete participate in?","A marathon","A sprint","L"
"MovingProc8","The_athlete ran the_marathon within_two_hours after he_had returned from_the_training_camp.",9,2,"content question","yes = 1","no = 5",1,"What event did the athlete participate in?","A marathon","A sprint","L"
"MovingProc8","The_athlete was_running the_marathon for_two_hours after he_had returned from_the_training_camp.",9,3,"content question","yes = 1","no = 5",2,"What event did the athlete participate in?","A marathon","A sprint","L"
"MovingProc8","Peter washed the_dishes for_an_hour after they had_finished dinner.",10,1,"content question","yes = 1","no = 5",1,"What did Peter have to do after dinner?","Clean the table","Wash the dishes","R"
"MovingProc8","Peter washed the_dishes within_an_hour after they had_finished dinner.",10,2,"content question","yes = 1","no = 5",2,"What did Peter have to do after dinner?","Clean the table","Wash the dishes","R"
"MovingProc8","Peter was_washing the_dishes for_an_hour after they had_finished dinner.",10,3,"content question","yes = 1","no = 5",3,"What did Peter have to do after dinner?","Clean the table","Wash the dishes","R"
"MovingProc8","Max played the_polka for_ten_minutes after Susan had_played her_favourite_piece.",11,1,"content question","yes = 1","no = 5",2,"What did Susan play?","Her favorite piece","The polka","L"
"MovingProc8","Max played the_polka within_ten_minutes after Susan had_played her_favourite_piece.",11,2,"content question","yes = 1","no = 5",3,"What did Susan play?","Her favorite piece","The polka","L"
"MovingProc8","Max was_playing the_polka for_ten_minutes after Susan had_played her_favourite_piece.",11,3,"content question","yes = 1","no = 5",1,"What did Susan play?","Her favorite piece","The polka","L"
"MovingProc8","The_pilot overflew the_Alps for_an_hour after he had_started in_Munich.",12,1,"content question","yes = 1","no = 5",3,"Where did the pilot start?","In Vienna","In Munich","R"
"MovingProc8","The_pilot overflew the_Alps within_an_hour after he had_started in_Munich.",12,2,"content question","yes = 1","no = 5",1,"Where did the pilot start?","In Vienna","In Munich","R"
"MovingProc8","The_pilot was_overflying the_Alps for_an_hour after he had_started in_Munich.",12,3,"content question","yes = 1","no = 5",2,"Where did the pilot start?","In Vienna","In Munich","R"
"MovingProc8","The_farmer planted the_field for_more_than_a_day after it_had eventually stopped_raining.",13,1,"content question","yes = 1","no = 5",1,"How was the weather?","It stopped raining","It started snowing","L"
"MovingProc8","The_farmer planted the_field within_a_day after it_had eventually stopped_raining.",13,2,"content question","yes = 1","no = 5",2,"How was the weather?","It stopped raining","It started snowing","L"
"MovingProc8","The_farmer was_planting the_field for_more_than_a_day after it_had eventually stopped_raining.",13,3,"content question","yes = 1","no = 5",3,"How was the weather?","It stopped raining","It started snowing","L"
"MovingProc8","Sarah's_mother prepared her_lunch_bag for_five_minutes after she had_made breakfast.",14,1,"content question","yes = 1","no = 5",2,"Who made breakfast?","Sarah’s father","Sarah’s mother","R"
"MovingProc8","Sarah's_mother prepared her_lunch_bag within_five_minutes after she had_made breakfast.",14,2,"content question","yes = 1","no = 5",3,"Who made breakfast?","Sarah’s father","Sarah’s mother","R"
"MovingProc8","Sarah's_mother was_preparing her_lunch_bag for_five_minutes after she had_made breakfast.",14,3,"content question","yes = 1","no = 5",1,"Who made breakfast?","Sarah’s father","Sarah’s mother","R"
"MovingProc8","Wilma patched the_trousers for_twenty_minutes after she got home.",15,1,"content question","yes = 1","no = 5",3,"What needed to be patched?","A pair of trousers","A dress","L"
"MovingProc8","Wilma patched the_trousers within_twenty_minutes after she got home.",15,2,"content question","yes = 1","no = 5",1,"What needed to be patched?","A pair of trousers","A dress","L"
"MovingProc8","Wilma was_patching the_trousers for_twenty_minutes after she got home.",15,3,"content question","yes = 1","no = 5",2,"What needed to be patched?","A pair of trousers","A dress","L"
"MovingProc8","The_mountaineer climbed the_north_face for_more_than_five_hours after the_sky had cleared_up.",16,1,"content question","yes = 1","no = 5",1,"How was the weather?","The sky became cloudy","The sky cleared up","R"
"MovingProc8","The_mountaineer climbed the_north_face within_five_hours after the_sky had cleared_up.",16,2,"content question","yes = 1","no = 5",2,"How was the weather?","The sky became cloudy","The sky cleared up","R"
"MovingProc8","The_mountaineer was_climbing the_north_face for_more_than_five_hours after the_sky had cleared_up.",16,3,"content question","yes = 1","no = 5",3,"How was the weather?","The sky became cloudy","The sky cleared up","R"
"MovingProc8","The_plumber repaired the_tap for_an_hour after he_had arrived at_Peter's_house.",17,1,"content question","yes = 1","no = 5",2,,,,
"MovingProc8","The_plumber repaired the_tap within_an_hour after he_had arrived at_Peter's_house.",17,2,"content question","yes = 1","no = 5",3,,,,
"MovingProc8","The_plumber was_repairing the_tap for_an_hour after he_had arrived at_Peter's_house.",17,3,"content question","yes = 1","no = 5",1,,,,
"MovingProc8","The_accountant balanced the_books for_more_than_three_weeks after he_had come_back from_his_vacation.",18,1,"content question","yes = 1","no = 5",3,,,,
"MovingProc8","The_accountant balanced the_books within_three_weeks after he_had come_back from_his_vacation.",18,2,"content question","yes = 1","no = 5",1,,,,
"MovingProc8","The_accountant was_balancing the_books for_more_than_three_weeks after he_had come_back from_his_vacation.",18,3,"content question","yes = 1","no = 5",2,,,,
"MovingProc8","Mr._Jones wrote the_letter for_thirty_minutes after he_had come_home from_work.",19,1,"content question","yes = 1","no = 5",1,,,,
"MovingProc8","Mr._Jones wrote the_letter within_thirty_minutes after he_had come_home from_work.",19,2,"content question","yes = 1","no = 5",2,,,,
"MovingProc8","Mr._Jones was_writing the_letter for_thirty_minutes after he_had come_home from_work.",19,3,"content question","yes = 1","no = 5",3,,,,
"MovingProc8","The_coach explained the_exercise for_ten_minutes after everyone had_arrived at_the_gym.",20,1,"content question","yes = 1","no = 5",2,,,,
"MovingProc8","The_coach explained the_exercise within_ten_minutes after everyone had_arrived at_the_gym.",20,2,"content question","yes = 1","no = 5",3,,,,
"MovingProc8","The_coach was_explaining the_exercise for_ten_minutes after everyone had_arrived at_the_gym.",20,3,"content question","yes = 1","no = 5",1,,,,
"MovingProc8","The_decorator created the_window_display for_more_than_three_days after she_had been_hired for_the_job.",21,1,"content question","yes = 1","no = 5",3,,,,
"MovingProc8","The_decorator created the_window_display within_three_days after she_had been_hired for_the_job.",21,2,"content question","yes = 1","no = 5",1,,,,
"MovingProc8","The_decorator was_creating the_window_display for_more_than_three_days after she_had been_hired for_the_job.",21,3,"content question","yes = 1","no = 5",2,,,,
"MovingProc8","The_thief emptied the_cash_registers for_a_minute after the_alarm had_already gone_off.",22,1,"content question","yes = 1","no = 5",1,,,,
"MovingProc8","The_thief emptied the_cash_registers within_a_minute after the_alarm had_already gone_off.",22,2,"content question","yes = 1","no = 5",2,,,,
"MovingProc8","The_thief was_emptying the_cash_registers for_a_minute after the_alarm had_already gone_off.",22,3,"content question","yes = 1","no = 5",3,,,,
"MovingProc8","Caroline performed the_rap_song for_two_minutes as_soon_as she_had memorized the_lyrics.",23,1,"content question","yes = 1","no = 5",2,,,,
"MovingProc8","Caroline performed the_rap_song within_two_minutes as_soon_as she_had memorized the_lyrics.",23,2,"content question","yes = 1","no = 5",3,,,,
"MovingProc8","Caroline was_performing the_rap_song for_two_minutes as_soon_as she_had memorized the_lyrics.",23,3,"content question","yes = 1","no = 5",1,,,,
"MovingProc8","The_boy ate_up his_lunch for_more_than_ten_minutes after history_class was over.",24,1,"content question","yes = 1","no = 5",3,,,,
"MovingProc8","The_boy ate_up his_lunch within_ten_minutes after history_class was over.",24,2,"content question","yes = 1","no = 5",1,,,,
"MovingProc8","The_boy was_eating_up his_lunch for_more_than_ten_minutes after history_class was over.",24,3,"content question","yes = 1","no = 5",2,,,,
"MovingProc8","The_fire_brigade extinguished the_fire for_two_hours as_soon_as they_had arrived at_the_site_of_the_blaze.",25,1,"content question","yes = 1","no = 5",1,,,,
"MovingProc8","The_fire_brigade extinguished the_fire within_two_hours as_soon_as they_had arrived at_the_site_of_the_blaze.",25,2,"content question","yes = 1","no = 5",2,,,,
"MovingProc8","The_fire_brigade was_extinguishing the_fire for_two_hours as_soon_as they_had arrived at_the_site_of_the_blaze.",25,3,"content question","yes = 1","no = 5",3,,,,
"MovingProc8","The_student printed_out the_article for_five_minutes after he_had downloaded the_PDF.",26,1,"content question","yes = 1","no = 5",2,,,,
"MovingProc8","The_student printed_out the_article within_five_minutes after he_had downloaded the_PDF.",26,2,"content question","yes = 1","no = 5",3,,,,
"MovingProc8","The_student was_printing_out the_article for_five_minutes after he_had downloaded the_PDF.",26,3,"content question","yes = 1","no = 5",1,,,,
"MovingProc8","The_military_commanders deployed the_troops for_two_days as_soon_as they had_received the_command.",27,1,"content question","yes = 1","no = 5",3,,,,
"MovingProc8","The_military_commanders deployed the_troops within_two_days as_soon_as they had_received the_command.",27,2,"content question","yes = 1","no = 5",1,,,,
"MovingProc8","The_military_commanders were_deploying the_troops for_two_days as_soon_as they had_received the_command.",27,3,"content question","yes = 1","no = 5",2,,,,
"MovingProc8","The_artist sketched his_design_of_the_church's_ceiling for_a_day after he_had received the_architect's_plans.",28,1,"content question","yes = 1","no = 5",1,,,,
"MovingProc8","The_artist sketched his_design_of_the_church's_ceiling within_a_day after he_had received the_architect's_plans.",28,2,"content question","yes = 1","no = 5",2,,,,
"MovingProc8","The_artist was_sketching his_design_of_the_church's_ceiling for_a_day after he_had received the_architect's_plans.",28,3,"content question","yes = 1","no = 5",3,,,,
"MovingProc8","The_administrator installed the_program for_more_than_an_hour after the_new computer_pool was_set_up.",29,1,"content question","yes = 1","no = 5",2,,,,
"MovingProc8","The_administrator installed the_program within_an_hour after the_new computer_pool was_set_up.",29,2,"content question","yes = 1","no = 5",3,,,,
"MovingProc8","The_administrator was_installing the_program for_more_than_an_hour after the_new computer_pool was_set_up.",29,3,"content question","yes = 1","no = 5",1,,,,
"MovingProc8","Mr._Peterson assembled the_new_computer for_an_hour after he_had bought the_spare_parts.",30,1,"content question","yes = 1","no = 5",3,,,,
"MovingProc8","Mr._Peterson assembled the_new_computer within_an_hour after he_had bought the_spare_parts.",30,2,"content question","yes = 1","no = 5",1,,,,
"MovingProc8","Mr._Peterson was_assembling the_new_computer for_an_hour after he_had bought the_spare_parts.",30,3,"content question","yes = 1","no = 5",2,,,,
"MovingProc8","The_tailor sewed the_suit for_three_days after Mr._Smith had ordered_it.",31,1,"content question","yes = 1","no = 5",1,,,,
"MovingProc8","The_tailor sewed the_suit within_three_days after Mr._Smith had ordered_it.",31,2,"content question","yes = 1","no = 5",2,,,,
"MovingProc8","The_tailor was_sewing the_suit for_three_days after Mr._Smith had ordered_it.",31,3,"content question","yes = 1","no = 5",3,,,,
"MovingProc8","The_barkeeper mixed the_drink for_more_than_one_minute after his_colleague had_given_him the_recipe.",32,1,"content question","yes = 1","no = 5",2,,,,
"MovingProc8","The_barkeeper mixed the_drink within_one_minute after his_colleague had_given_him the_recipe.",32,2,"content question","yes = 1","no = 5",3,,,,
"MovingProc8","The_barkeeper was_mixing the_drink for_more_than_one_minute after his_colleague had_given_him the_recipe.",32,3,"content question","yes = 1","no = 5",1,,,,
"MovingProc8","The_sailor tied the_knot for_one_minute after he_had put_up the_sail.",33,1,"content question","yes = 1","no = 5",3,,,,
"MovingProc8","The_sailor tied the_knot within_one_minute after he_had put_up the_sail.",33,2,"content question","yes = 1","no = 5",1,,,,
"MovingProc8","The_sailor was_tying the_knot for_one_minute after he_had put_up the_sail.",33,3,"content question","yes = 1","no = 5",2,,,,
"MovingProc8","The_boy swam the_fifty_meters_distance for_thirty_seconds after he_had dived from_the_starting_block.",34,1,"content question","yes = 1","no = 5",1,,,,
"MovingProc8","The_boy swam the_fifty_meters_distance within_thirty_seconds after he_had dived from_the_starting_block.",34,2,"content question","yes = 1","no = 5",2,,,,
"MovingProc8","The_boy was_swimming the_fifty_meters_distance for_thirty_seconds after he_had dived from_the_starting_block.",34,3,"content question","yes = 1","no = 5",3,,,,
"MovingProc8","The_boy drained the_bottle_of_soda for_more_than_a_minute after he_had been_playing basketball_the_whole_morning.",35,1,"content question","yes = 1","no = 5",2,,,,
"MovingProc8","The_boy drained the_bottle_of_soda within_a_minute after he_had been_playing basketball_the_whole_morning.",35,2,"content question","yes = 1","no = 5",3,,,,
"MovingProc8","The_boy was_draining the_bottle_of_soda for_more_than_a_minute after he_had been_playing basketball_the_whole_morning.",35,3,"content question","yes = 1","no = 5",1,,,,
"MovingProc8","The_plane overflew the_Pyrenees for_twenty_minutes after it_had started in_Barcelona.",36,1,"content question","yes = 1","no = 5",3,,,,
"MovingProc8","The_plane overflew the_Pyrenees within_twenty_minutes after it_had started in_Barcelona.",36,2,"content question","yes = 1","no = 5",1,,,,
"MovingProc8","The_plane was_overflying the_Pyrenees for_twenty_minutes after it_had started in_Barcelona.",36,3,"content question","yes = 1","no = 5",2,,,,
"MovingProc8","Little_Timmy removed the_splinter for_more_than_five_minutes after he_could no_longer stand_the_pain.",37,1,"content question","yes = 1","no = 5",1,,,,
"MovingProc8","Little_Timmy removed the_splinter within_five_minutes after he_could no_longer stand_the_pain.",37,2,"content question","yes = 1","no = 5",2,,,,
"MovingProc8","Little_Timmy was_removing the_splinter for_more_than_five_minutes after he_could no_longer stand_the_pain.",37,3,"content question","yes = 1","no = 5",3,,,,
"MovingProc8","The_cyclist crossed the_long_bridge for_three_minutes after he_had caught_up with_the_field.",38,1,"content question","yes = 1","no = 5",2,,,,
"MovingProc8","The_cyclist crossed the_long_bridge within_three_minutes after he_had caught_up with_the_field.",38,2,"content question","yes = 1","no = 5",3,,,,
"MovingProc8","The_cyclist was_crossing the_long_bridge for_three_minutes after he_had caught_up with_the_field.",38,3,"content question","yes = 1","no = 5",1,,,,
"MovingProc8","Bob built the_fire for_more_than_five_minutes after he_had set_up his_tent.",39,1,"content question","yes = 1","no = 5",3,,,,
"MovingProc8","Bob built the_fire within_five_minutes after he_had set_up his_tent.",39,2,"content question","yes = 1","no = 5",1,,,,
"MovingProc8","Bob was_building the_fire for_more_than_five_minutes after he_had set_up his_tent.",39,3,"content question","yes = 1","no = 5",2,,,,
"MovingProc8","Susan gobbled_up the_plate_of_fried_chicken for_ten_minutes after she_could eventually take_her_break.",40,1,"content question","yes = 1","no = 5",1,,,,
"MovingProc8","Susan gobbled_up the_plate_of_fried_chicken within_ten_minutes after she_could eventually take_her_break.",40,2,"content question","yes = 1","no = 5",2,,,,
"MovingProc8","Susan was_gobbling_up the_plate_of_fried_chicken for_ten_minutes after she_could eventually take_her_break.",40,3,"content question","yes = 1","no = 5",3,,,,
"MovingProc8","Carl inhaled the_delicious_chocolate_cake for_twenty_minutes after he had gotten_home.",41,1,"content question","yes = 1","no = 5",2,,,,
"MovingProc8","Carl inhaled the_delicious_chocolate_cake within_twenty_minutes after he had_gotten home.",41,2,"content question","yes = 1","no = 5",3,,,,
"MovingProc8","Carl was_inhaling the_delicious_chocolate_cake for_twenty_minutes after he had gotten_home.",41,3,"content question","yes = 1","no = 5",1,,,,
"MovingProc8","The_athlete poured_down the_bottle_of_water for_more_than_two_minutes after he_had won the_competition.",42,1,"content question","yes = 1","no = 5",3,,,,
"MovingProc8","The_athlete poured_down the_bottle_of_water within_two_minutes after he_had won the_competition.",42,2,"content question","yes = 1","no = 5",1,,,,
"MovingProc8","The_athlete was_pouring_down the_bottle_of_water for_more_than_two_minutes after he_had won the_competition.",42,3,"content question","yes = 1","no = 5",2,,,,
"MovingProc8","The_alcoholic downed the_can_of_beer for_a_minute after he_had left the_corner_store.",43,1,"content question","yes = 1","no = 5",1,,,,
"MovingProc8","The_alcoholic downed the_can_of_beer within_a_minute after he_had left the_corner_store.",43,2,"content question","yes = 1","no = 5",2,,,,
"MovingProc8","The_alcoholic was_downing the_can_of_beer for_a_minute after he_had left the_corner_store.",43,3,"content question","yes = 1","no = 5",3,,,,
"MovingProc8","Bill cleared_away the_plate_of_potatoes for_ten_minutes after the_basketball_game on_TV was_over.",44,1,"content question","yes = 1","no = 5",2,,,,
"MovingProc8","Bill cleared_away the_plate_of_potatoes within_ten_minutes after the_basketball_game on_TV was_over.",44,2,"content question","yes = 1","no = 5",3,,,,
"MovingProc8","Bill was_clearing_away the_plate_of_potatoes for_ten_minutes after the_basketball_game on_TV was_over.",44,3,"content question","yes = 1","no = 5",1,,,,
"MovingProc8","The_scout set_up the_tent for_more_than_ten_minutes after he_had been_hiking all_day.",45,1,"content question","yes = 1","no = 5",3,,,,
"MovingProc8","The_scout set_up the_tent within_ten_minutes after he_had been_hiking all_day.",45,2,"content question","yes = 1","no = 5",1,,,,
"MovingProc8","The_scout was_setting_up the_tent for_more_than_ten_minutes after he_had been_hiking all_day.",45,3,"content question","yes = 1","no = 5",2,,,,
"MovingProc8","The_architect constructed the_bridge for_five_months after he_had won the_competition.",46,1,"content question","yes = 1","no = 5",1,,,,
"MovingProc8","The_architect constructed the_bridge within_five_months after he_had won the_competition.",46,2,"content question","yes = 1","no = 5",2,,,,
"MovingProc8","The_architect was_constructing the_bridge for_five_months after he_had won the_competition.",46,3,"content question","yes = 1","no = 5",3,,,,
"MovingProc8","The_architect drew_up the_plans for_two_months after the_client_had signed the_contract.",47,1,"content question","yes = 1","no = 5",2,,,,
"MovingProc8","The_architect drew_up the_plans within_two_months after the_client_had signed the_contract.",47,2,"content question","yes = 1","no = 5",3,,,,
"MovingProc8","The_architect was_drawing_up the_plans for_two_months after the_client_had signed the_contract.",47,3,"content question","yes = 1","no = 5",1,,,,
"MovingProc8","The_girl put_together the_puzzle for_more_than_one_hour after she_had come_home from_school.",48,1,"content question","yes = 1","no = 5",3,,,,
"MovingProc8","The_girl put_together the_puzzle within_one_hour after she_had come_home from_school.",48,2,"content question","yes = 1","no = 5",1,,,,
"MovingProc8","The_girl was_putting_together the_puzzle for_more_than_one_hour after she_had come_home from_school.",48,3,"content question","yes = 1","no = 5",2,,,,
"MovingProc6","During_the_night the_writer stumbled in the_crowded apartment.",49,7,"makes sense?","yes = 1","no = 5",1,"Where did the writer stumble?","In the apartment","In the street","L"
